{
  "contract_id": "contract_a2a_001",
  "contract_type": "delegated_task",
  "protocol_version": "1.1",
  "requester": {
    "id": "did:example:requester",
    "id_type": "did",
    "display_name": "Requester Org"
  },
  "provider": {
    "id": "did:example:provider",
    "id_type": "did",
    "display_name": "Code Review Agent"
  },
  "created_at": "2026-04-30T10:00:00.000000Z",
  "deadline_at": "2026-04-30T14:00:00.000000Z",
  "task_category": "code_review",
  "task_summary": "Review PR #482 for security issues.",
  "task_payload_ref": {
    "uri": "https://example.com/payloads/pr482.json"
  },
  "execution_transport": "a2a",
  "execution_refs": {
    "agent_card_url": "https://example.com/.well-known/agent-card.json",
    "task_id": "task_456",
    "message_ids": ["msg_1", "msg_2"],
    "artifact_ids": ["artifact_1"]
  },
  "output_requirements": {
    "format": "markdown"
  },
  "evidence_requirements": {
    "kinds": ["artifact"]
  },
  "lifecycle_status": "in_progress"
}
