{
  "contract_id": "contract_audit_001",
  "contract_type": "delegated_task",
  "protocol_version": "1.1",
  "requester": { "id": "did:example:requester", "id_type": "did" },
  "provider": { "id": "did:example:provider", "id_type": "did" },
  "created_at": "2026-04-30T10:00:00.000000Z",
  "accepted_at": "2026-04-30T10:00:05.000000Z",
  "task_category": "summarization",
  "task_summary": "Summarize attached document.",
  "execution_transport": "api",
  "execution_refs": {
    "endpoint": "https://provider.example.com/api/v1/jobs",
    "job_id": "job_001"
  },
  "lifecycle_status": "completed",
  "audit_events": [
    {
      "event_id": "evt_001",
      "timestamp": "2026-04-30T10:00:00.000000Z",
      "actor": { "id": "did:example:requester", "id_type": "did" },
      "event_type": "lifecycle_transition",
      "details": { "to": "proposed" }
    },
    {
      "event_id": "evt_002",
      "timestamp": "2026-04-30T10:00:05.000000Z",
      "actor": { "id": "did:example:provider", "id_type": "did" },
      "event_type": "lifecycle_transition",
      "details": { "from": "proposed", "to": "accepted" },
      "previous_event_id": "evt_001"
    },
    {
      "event_id": "evt_003",
      "timestamp": "2026-04-30T10:00:10.000000Z",
      "actor": { "id": "did:example:provider", "id_type": "did" },
      "event_type": "lifecycle_transition",
      "details": { "from": "accepted", "to": "in_progress" },
      "previous_event_id": "evt_002"
    },
    {
      "event_id": "evt_004",
      "timestamp": "2026-04-30T10:01:30.000000Z",
      "actor": { "id": "did:example:provider", "id_type": "did" },
      "event_type": "evidence_added",
      "details": {
        "evidence": {
          "kind": "artifact",
          "uri": "https://example.com/outputs/summary.md",
          "content_hash": "sha256:def456..."
        }
      },
      "previous_event_id": "evt_003"
    },
    {
      "event_id": "evt_005",
      "timestamp": "2026-04-30T10:01:31.000000Z",
      "actor": { "id": "did:example:provider", "id_type": "did" },
      "event_type": "lifecycle_transition",
      "details": { "from": "in_progress", "to": "completed" },
      "previous_event_id": "evt_004"
    }
  ]
}
